{
 "job_id": "fixture-mayur-vihar-001",
 "model_version": "segformer-b2-delhi-fp-v1",
 "type": "FeatureCollection",
 "features": [
  {
   "type": "Feature",
   "geometry": {
    "type": "Polygon",
    "coordinates": [
     [
      [
       77.2935613,
       28.6040841
      ],
      [
       77.2936357,
       28.6039278
      ],
      [
       77.2935176,
       28.6038807
      ],
      [
       77.2934434,
       28.6040371
      ],
      [
       77.2935613,
       28.6040841
      ]
     ]
    ]
   },
   "properties": {
    "id": "r1",
    "kind": "roof",
    "roof_type": "flat",
    "azimuth_deg": null,
    "tilt_deg": null,
    "confidence": 0.761
   }
  },
  {
   "type": "Feature",
   "geometry": {
    "type": "Polygon",
    "coordinates": [
     [
      [
       77.2935422,
       28.6039236
      ],
      [
       77.2935623,
       28.6039236
      ],
      [
       77.2935636,
       28.6039177
      ],
      [
       77.2935583,
       28.6039142
      ],
      [
       77.2935569,
       28.6039106
      ],
      [
       77.2935449,
       28.6039071
      ],
      [
       77.2935395,
       28.6039106
      ],
      [
       77.2935395,
       28.6039189
      ],
      [
       77.2935422,
       28.6039236
      ]
     ]
    ]
   },
   "properties": {
    "id": "o1",
    "kind": "obstacle",
    "roof_id": "r1",
    "class": "other",
    "height_m": null,
    "confidence": 0.565
   }
  },
  {
   "type": "Feature",
   "geometry": {
    "type": "Polygon",
    "coordinates": [
     [
      [
       77.2935328,
       28.6040366
      ],
      [
       77.2935408,
       28.6040484
      ],
      [
       77.2935449,
       28.604046
      ],
      [
       77.2935569,
       28.604046
      ],
      [
       77.2935543,
       28.6040437
      ],
      [
       77.2935556,
       28.6040331
      ],
      [
       77.2935489,
       28.6040237
      ],
      [
       77.2935368,
       28.6040272
      ],
      [
       77.2935368,
       28.6040343
      ],
      [
       77.2935328,
       28.6040366
      ]
     ]
    ]
   },
   "properties": {
    "id": "o2",
    "kind": "obstacle",
    "roof_id": "r1",
    "class": "other",
    "height_m": null,
    "confidence": 0.64
   }
  }
 ]
}